<?xml version="1.0" encoding="UTF-8"?>
<?xml-stylesheet type="text/xsl" href="music.xsl"?>

<!--<albums xmlns:xsi="http://www.w3.org/2001/XMLSchema-instance"-->
<!--        xsi:schemaLocation="albums music.xsd"-->
<!--        xmlns="albums">-->
<albums>
    <authors>
        <author>
            <authorName>Piotr</authorName>
            <authorSurname>Antczak</authorSurname>
            <authorindex>224248</authorindex>
        </author>
        <author>
            <authorName>Mikołaj</authorName>
            <authorSurname>Bajkowski</authorSurname>
            <authorindex>224251</authorindex>
        </author>
    </authors>
    <bandlist>
        <bandinfo band_id="BKey">
            <name>The Black Keys</name>
        </bandinfo>
        <bandinfo band_id="Weez">
            <name>Weezer</name>
        </bandinfo>
        <bandinfo band_id="DPun">
            <name>Daft Punk</name>
        </bandinfo>
        <bandinfo band_id="LL">
            <name>Laki Lan</name>
        </bandinfo>
        <bandinfo band_id="Avic">
            <name>Avicii</name>
        </bandinfo>
        <bandinfo band_id="MJac">
            <name>Michael Jackson</name>
        </bandinfo>
        <bandinfo band_id="ATCu">
            <name>Against The Current</name>
        </bandinfo>
        <bandinfo band_id="FMac">
            <name>Fletwood Mac</name>
        </bandinfo>
        <bandinfo band_id="EJoh">
            <name>Elton John</name>
        </bandinfo>
        <bandinfo band_id="Slip">
            <name>Slipknot</name>
        </bandinfo>
        <bandinfo band_id="BMar">
            <name>Bob Marley</name>
        </bandinfo>
        <bandinfo band_id="MDav">
            <name>Miles Davis</name>
        </bandinfo>
        <bandinfo band_id="Muse">
            <name>Muse</name>
        </bandinfo>
    </bandlist>
    <!--Collection/Kolekcja płyt-->
    <albumlist>
        <album genre_type="Rock" type="Vinyl" id="A1">
            <info>
                <album_title>Let's Rock</album_title>
                <band band_id_ref="BKey">The Black Keys</band>
                <studio>Easy Eye Sound</studio>
                <release_year>2019-06-28</release_year>
                <number_of_songs> 12 </number_of_songs>
                <total_length>00:38:30</total_length>
                <number_of_disks>1</number_of_disks>
                <serial_number>CD-22345-AA4</serial_number>
                <shop_id>234P45Y</shop_id>
                <rating>8.7</rating>
                <price>80.00</price>
            </info>
            <pic1 p_id="LR"/>
            <songs>
                <song>
                    <title>Shine A Little Light</title>
                    <song_length>3:17</song_length>
                </song>
                <song>
                    <title>Eagle Birds</title>
                    <song_length>2:41</song_length>
                </song>
                <song>
                    <title>Lo/Hi</title>
                    <song_length>2:58</song_length>
                </song>
                <song>
                    <title>Walk Across the Water</title>
                    <song_length>3:56</song_length>
                </song>
                <song>
                    <title>Tell me Lies</title>
                    <song_length>3:40</song_length>
                </song>
                <song>
                    <title>Every Little Thing</title>
                    <song_length>3:20</song_length>
                </song>
                <song>
                    <title>Get Yourself Together</title>
                    <song_length>3:57</song_length>
                </song>
                <song>
                    <title>Sit Around and Miss You</title>
                    <song_length>2:41</song_length>
                </song>
                <song>
                    <title>Go</title>
                    <song_length>2:27</song_length>
                </song>
                <song>
                    <title>Breaking Down</title>
                    <song_length>3:25</song_length>
                </song>
                <song>
                    <title>Under the Gun</title>
                    <song_length>3:16</song_length>
                </song>
                <song>
                    <title>Fire Walk with Me</title>
                    <song_length>2:58</song_length>
                </song>
            </songs>
        </album>
        <album genre_type="Rock" type="CD" id="A2">
            <info>
                <album_title>El Camino</album_title>
                <band band_id_ref="BKey">The Black Keys</band>
                <studio>Nonesuch Records</studio>
                <release_year>2011-12-02</release_year>
                <number_of_songs>11</number_of_songs>
                <total_length>00:37:42</total_length>
                <number_of_disks>1</number_of_disks>
                <serial_number>CD-27325-AA4</serial_number>
                <shop_id>368B67U</shop_id>
                <rating>8.9</rating>
                <price>45.00</price>
            </info>
            <pic1 p_id="EC"/>
            <songs>
                <song>
                    <title>Lonley Boy</title>
                    <song_length>3:13</song_length>
                </song>
                <song>
                    <title>Dead and Gone</title>
                    <song_length>3:41</song_length>
                </song>
                <song>
                    <title>Cold on the Ceiling</title>
                    <song_length>2:44</song_length>
                </song>
                <song>
                    <title>Little black Submarines</title>
                    <song_length>4:11</song_length>
                </song>
                <song>
                    <title>Money Maker</title>
                    <song_length>2:57</song_length>
                </song>
                <song>
                    <title>Run Right Back</title>
                    <song_length>3:17</song_length>
                </song>
                <song>
                    <title>Sister</title>
                    <song_length>3:25</song_length>
                </song>
                <song>
                    <title>Hello of a Season</title>
                    <song_length>3:45</song_length>
                </song>
                <song>
                    <title>Stop Stop</title>
                    <song_length>3:30</song_length>
                </song>
                <song>
                    <title>Nova Baby</title>
                    <song_length>3:27</song_length>
                </song>
                <song>
                    <title>Mind Eraser</title>
                    <song_length>3:15</song_length>
                </song>
            </songs>
        </album>
        <album genre_type="Rock" type="Vinyl" id="A3">
            <info>
                <album_title>Turn Blue</album_title>
                <band band_id_ref="BKey">The Black Keys</band>
                <studio>Nonesuch Records</studio>
                <release_year>2014-05-12</release_year>
                <number_of_songs>11</number_of_songs>
                <total_length>00:45:09</total_length>
                <number_of_disks>1</number_of_disks>
                <serial_number>CD-22925-AA4</serial_number>
                <shop_id>368B67U</shop_id>
                <rating>7.9</rating>
                <price>75.00</price>
            </info>
            <pic1 p_id="TB"/>
            <songs>
                <song>
                    <title>Weight of Love</title>
                    <song_length>6:50</song_length>
                </song>
                <song>
                    <title>In Time</title>
                    <song_length>4:28</song_length>
                </song>
                <song>
                    <title>Turn Blue</title>
                    <song_length>3:42</song_length>
                </song>
                <song>
                    <title>Fever</title>
                    <song_length>4:06</song_length>
                </song>
                <song>
                    <title>Year in Review</title>
                    <song_length>3:48</song_length>
                </song>
                <song>
                    <title>Bullet in the Brain</title>
                    <song_length>4:15</song_length>
                </song>
                <song>
                    <title>It's Up to You Now</title>
                    <song_length>3:10</song_length>
                </song>
                <song>
                    <title>Waiting in Words</title>
                    <song_length>3:37</song_length>
                </song>
                <song>
                    <title>10 Lovers</title>
                    <song_length>3:33</song_length>
                </song>
                <song>
                    <title>In our Prime</title>
                    <song_length>4:38</song_length>
                </song>
                <song>
                    <title>Gotta Get Away</title>
                    <song_length>3:02</song_length>
                </song>
            </songs>
        </album>
        <album genre_type="Rock" type="CD" id="A4">
            <info>
                <album_title>Weezer</album_title>
                <band band_id_ref="Weez">Weezer</band>
                <studio>Crush Music, Atlantic Records</studio>
                <release_year>2019-03-01</release_year>
                <number_of_songs>10</number_of_songs>
                <total_length>00:37:33</total_length>
                <number_of_disks>1</number_of_disks>
                <serial_number>CD-12745-DA4</serial_number>
                <shop_id>588Z34H</shop_id>
                <rating>8.3</rating>
                <price>45.00</price>
            </info>
            <pic1 p_id="WR"/>
            <songs>
                <song>
                    <title>Can't Knock the Hustle</title>
                    <song_length>3:35</song_length>